{"$id":"https://surfaces.dev/schemas/surfaceops-kanban-live/surfaceops-kanban-live-preflight-mutation.v0.schema.json","$schema":"https://json-schema.org/draft/2020-12/schema","additionalProperties":false,"properties":{"apiManifestRef":{"additionalProperties":false,"properties":{"hash":{"pattern":"^[0-9a-f]{64}$","type":"string"},"hashAlgorithm":{"const":"sha256"},"path":{"type":"string"},"schemaId":{"type":"string"},"sourceEvidenceHash":{"pattern":"^[0-9a-f]{64}$","type":"string"},"sourceRef":{"type":["string","null"]}},"required":["path","schemaId","hashAlgorithm","hash","sourceRef"],"type":"object"},"authorityOverride":{"type":"boolean"},"conflictSilentOverwrite":{"type":"boolean"},"diagnosticCodes":{"items":{"type":"string"},"type":"array"},"evidenceRefs":{"items":{"additionalProperties":false,"properties":{"hash":{"pattern":"^[0-9a-f]{64}$","type":"string"},"hashAlgorithm":{"const":"sha256"},"path":{"type":"string"},"schemaId":{"type":"string"},"sourceEvidenceHash":{"pattern":"^[0-9a-f]{64}$","type":"string"},"sourceRef":{"type":["string","null"]}},"required":["path","schemaId","hashAlgorithm","hash","sourceRef"],"type":"object"},"type":"array"},"expectedPromotionStatus":{"enum":["allowed","blocked","review_required"]},"expectedResult":{"enum":["valid","invalid","review_required"]},"fixtureId":{"type":"string"},"fixtureKind":{"enum":["valid","invalid","review_required"]},"idempotencyMissing":{"type":"boolean"},"laneMoveSignal":{"type":"boolean"},"missingEvidenceRef":{"type":"boolean"},"mutation":{"type":["string","null"]},"permissionBypass":{"type":"boolean"},"productionUrl":{"type":"boolean"},"provenance":{"additionalProperties":false,"properties":{"generatedAt":{"const":"1970-01-01T00:00:00.000Z"},"generator":{"type":"string"},"sourceRefs":{"items":{"type":"string"},"type":"array"}},"required":["generatedAt","generator","sourceRefs"],"type":"object"},"scenarioId":{"type":"string"},"schemaId":{"const":"surfaceops-kanban-live-preflight-mutation.v0"},"secretLeak":{"type":"boolean"},"targetId":{"type":"string"},"targetOutOfScope":{"type":"boolean"},"unsupportedEndpoint":{"type":"boolean"},"version":{"const":"0.0.0"}},"required":["schemaId","version","fixtureId","scenarioId","targetId","fixtureKind","expectedResult","expectedPromotionStatus","diagnosticCodes","mutation","authorityOverride","targetOutOfScope","missingEvidenceRef","secretLeak","unsupportedEndpoint","productionUrl","permissionBypass","conflictSilentOverwrite","idempotencyMissing","laneMoveSignal","evidenceRefs","apiManifestRef","provenance"],"type":"object"}