{"apiManifestRef":{"hash":"0438bb49b2b23197e79b60a5325a5061e066179a42bf4b013c5fcfdece16b4d5","hashAlgorithm":"sha256","path":"sources/surfaceops-kanban-live/kanban-cards-api-manifest.json","schemaId":"kanban-cards-api-manifest.v0","sourceRef":null},"authorityOverride":false,"conflictSilentOverwrite":false,"diagnosticCodes":["SURFACEOPS_KANBAN_LIVE_API_MANIFEST_HASH_MISMATCH"],"evidenceRefs":[{"hash":"08c4c9e62c8643e7427b60f1ad8e48c86cfa5fced0ad1e0d3b6c3e0e5025589c","hashAlgorithm":"sha256","path":"artifacts/p3/evidence.json","schemaId":"agent-orchestration-evidence.v0","sourceRef":null},{"hash":"aac26d2171acaaabbe27c6262d45575eac8bf08c6e6a5284c1340cec184694da","hashAlgorithm":"sha256","path":"artifacts/p3/review-queue.json","schemaId":"agent-review-queue.v0","sourceEvidenceHash":"08c4c9e62c8643e7427b60f1ad8e48c86cfa5fced0ad1e0d3b6c3e0e5025589c","sourceRef":null},{"hash":"a15550b663925ffeedb30c29b217f778aa5cb4b78d50bc2ba9f3b3ce81700cfc","hashAlgorithm":"sha256","path":"artifacts/p3/agent-orchestration-report.json","schemaId":"agent-orchestration-report.v0","sourceEvidenceHash":"08c4c9e62c8643e7427b60f1ad8e48c86cfa5fced0ad1e0d3b6c3e0e5025589c","sourceRef":null},{"hash":"a9de1573bc5c4dcd9e0d509d8b60885470a4d6cb2bfcbc0eff5ed451997d71f3","hashAlgorithm":"sha256","path":"artifacts/p4/evidence.json","schemaId":"review-judgment-evidence.v0","sourceRef":null},{"hash":"91dd2b08dc7c99f2ff28c6dca2862379269f0f89c7feb63a073bd51fc5f1ebb8","hashAlgorithm":"sha256","path":"artifacts/p4/surfaceops-decision-ledger.json","schemaId":"surfaceops-decision-ledger.v0","sourceEvidenceHash":"a9de1573bc5c4dcd9e0d509d8b60885470a4d6cb2bfcbc0eff5ed451997d71f3","sourceRef":null},{"hash":"ca31dcd66c7037e0b8eff4e24ad5a41ae99497d7a44bc7a558f85bd981f32add","hashAlgorithm":"sha256","path":"artifacts/p4/review-judgment-report.json","schemaId":"review-judgment-report.v0","sourceEvidenceHash":"a9de1573bc5c4dcd9e0d509d8b60885470a4d6cb2bfcbc0eff5ed451997d71f3","sourceRef":null},{"hash":"f792803e20a7bca5e235ab332b8b264e3a284bd4d93ba1abc1227582de889243","hashAlgorithm":"sha256","path":"artifacts/p4/judgmentkit-evaluation-report.json","schemaId":"judgmentkit-evaluation-report.v0","sourceEvidenceHash":"a9de1573bc5c4dcd9e0d509d8b60885470a4d6cb2bfcbc0eff5ed451997d71f3","sourceRef":null}],"expectedPromotionStatus":"blocked","expectedResult":"invalid","fixtureId":"mutations.api.manifest.hash.mismatch.surfaceops.kanban.live.preflight.json","fixtureKind":"invalid","idempotencyMissing":false,"laneMoveSignal":false,"missingEvidenceRef":false,"mutation":"SURFACEOPS_KANBAN_LIVE_API_MANIFEST_HASH_MISMATCH","permissionBypass":false,"productionUrl":false,"provenance":{"generatedAt":"1970-01-01T00:00:00.000Z","generator":"surfaceops-kanban-live-fixture","sourceRefs":["fixtures/surfaceops-kanban-live/mutations/api-manifest-hash-mismatch.surfaceops-kanban-live-preflight.json"]},"scenarioId":"designer-surfaceops-approval-live-kanban","schemaId":"surfaceops-kanban-live-preflight-mutation.v0","secretLeak":false,"targetId":"surfaceops-kanban-live","targetOutOfScope":false,"unsupportedEndpoint":false,"version":"0.0.0"}